negative,hide new secretions from the parental units
negative,"contains no wit , only labored gags "
positive,that loves its characters and communicates something rather beautiful about human nature 
negative,remains utterly satisfied to remain the same throughout 
negative,on the worst revenge-of-the-nerds clichés the filmmakers could dredge up 
negative,that 's far too tragic to merit such superficial treatment 
positive,"demonstrates that the director of such hollywood blockbusters as patriot games can still turn out a small , personal film with an emotional wallop . "
positive,of saucy 
negative,a depressed fifteen-year-old 's suicidal poetry 
positive,are more deeply thought through than in most ` right-thinking ' films 
negative,goes to absurd lengths 
negative,for those moviegoers who complain that ` they do n't make movies like they used to anymore 
negative,"the part where nothing 's happening , "
negative,saw how bad this movie was 
negative,lend some dignity to a dumb story 
positive,the greatest musicians 
negative,cold movie 
positive,with his usual intelligence and subtlety 
negative,redundant concept 
positive,"swimming is above all about a young woman 's face , and by casting an actress whose face projects that woman 's doubts and yearnings , it succeeds . "
positive,equals the original and in some ways even betters it 
positive,"if anything , see it for karen black , who camps up a storm as a fringe feminist conspiracy theorist named dirty dick . "
positive,a smile on your face 
positive,"comes from the brave , uninhibited performances "
negative,excruciatingly unfunny and pitifully unromantic 
positive,enriched by an imaginatively mixed cast of antic spirits 
negative,"which half of dragonfly is worse : the part where nothing 's happening , or the part where something 's happening "
positive,in world cinema 
positive,very good viewing alternative 
negative,"the plot is nothing but boilerplate clichés from start to finish , "
negative,the action is stilted 
positive,on all cylinders 
negative,"will find little of interest in this film , which is often preachy and poorly acted "
negative,by far the worst movie of the year 
negative,"sit through , "
positive,more than another `` best man '' clone by weaving a theme throughout this funny film 
positive,it 's about issues most adults have to face in marriage and i think that 's what i liked about it -- the real issues tucked between the silly and crude storyline 
positive,heroes 
negative,oblivious to the existence of this film 
positive,sharply 
negative,"the entire point of a shaggy dog story , of course , is that it goes nowhere , and this is classic nowheresville in every sense . "
negative,sometimes dry 
negative,"as they come , already having been recycled more times than i 'd care to count "
positive,"covers this territory with wit and originality , suggesting that with his fourth feature "
negative,a $ 40 million version of a game 
positive,gorgeous and deceptively minimalist 
positive,cross swords with the best of them and 
negative,as a fringe feminist conspiracy theorist 
positive,"proves once again he has n't lost his touch , bringing off a superb performance in an admittedly middling film . "
negative,disappointments 
negative,the horrors 
positive,a muddle splashed with bloody beauty as vivid as any scorsese has ever given us . 
negative,many pointless 
positive,a beautifully 
negative,"contrived , well-worn situations "
negative,a doa 
negative,poor ben bratt could n't find stardom if mapquest emailed him point-to-point driving directions . 
positive,to be as subtle and touching as the son 's room 
positive,starts with a legend 
negative,far less sophisticated and 
positive,rich veins of funny stuff in this movie 
negative,no apparent joy 
negative,shot on ugly digital video 
negative,... a sour little movie at its core ; an exploration of the emptiness that underlay the relentless gaiety of the 1920 's ... the film 's ending has a `` what was it all for ? '' 
negative,"though ford and neeson capably hold our interest , but its just not a thrilling movie "
positive,is pretty damned funny . 
negative,we never feel anything for these characters 
negative,'s a lousy one at that 
negative,the corporate circus that is the recording industry in the current climate of mergers and downsizing 
positive,"the storylines are woven together skilfully , the magnificent swooping aerial shots are breathtaking , and the overall experience is awesome . "
negative,of the most highly-praised disappointments i 
negative,"sounds like a cruel deception carried out by men of marginal intelligence , with reactionary ideas about women and a total lack of empathy . "
positive,seem fresh 
negative,to the dustbin of history 
negative,"as a director , eastwood is off his game "
positive,pays earnest homage to turntablists 
negative,weak and 
negative,"skip this dreck , "
negative,contains very few laughs and even less surprises 
positive,film to affirm love 's power to help people endure almost unimaginable horror 
positive,are an absolute joy 
positive,generates 
positive,", like life , is n't much fun without the highs and lows "
positive,based on a true and historically significant story 
positive,well-rounded tribute 
negative,", though many of the actors throw off a spark or two when they first appear , they ca n't generate enough heat in this cold vacuum of a comedy to start a reaction . "
positive,so much like a young robert deniro 
positive,"khouri manages , with terrific flair , to keep the extremes of screwball farce and blood-curdling family intensity on one continuum . "
positive,fashioning an engrossing entertainment out 
positive,spiffy animated feature 
negative,that 's so sloppily written and cast that you can not believe anyone more central to the creation of bugsy than the caterer 
positive,"alternating between facetious comic parody and pulp melodrama , this smart-aleck movie ... tosses around some intriguing questions about the difference between human and android life "
negative,strung-together moments 
positive,", generous and subversive artworks "
positive,"it does n't follow the stale , standard , connect-the-dots storyline which has become commonplace in movies that explore the seamy underbelly of the criminal world "
positive,funny yet 
negative,overbearing and over-the-top 
positive,it 's robert duvall ! 
positive,rich and sudden wisdom 
positive,"acted and directed , it 's clear that washington most certainly has a new career ahead of him "
positive,in memory 
positive,respectable new one 
negative,yet this grating showcase 
positive,hate to tear your eyes away from the images long enough to read the subtitles 
negative,addition to sporting one of the worst titles in recent cinematic history 
positive,", this gender-bending comedy is generally quite funny . "
negative,"build some robots , haul 'em to the theater with you for the late show , and put on your own mystery science theatre 3000 tribute to what is almost certainly going to go down as the worst -- and only -- killer website movie of this or any other year "
negative,do n't work in concert 
positive,"the direction has a fluid , no-nonsense authority , and the performances by harris , phifer and cam ` ron seal the deal . "
positive,would have liked it more if it had just gone that one step further 
negative,"it 's too harsh to work as a piece of storytelling , "
positive,hawaiian shirt 
positive,"takes a classic story , casts attractive and talented actors and uses a magnificent landscape to create a feature film that is wickedly fun to watch . "
positive,provide its keenest pleasures 
negative,altogether too slight to be called any kind of masterpiece 
negative,grievous but 
negative,"after you laugh once ( maybe twice ) , you will have completely forgotten the movie by the time you get back to your car in the parking lot . "
negative,hopeless 
positive,"unpretentious , charming , quirky , original "
negative,nicks and steinberg match their own creations for pure venality -- that 's giving it the old college try . 
positive,very well-written and very well-acted . 
negative,are n't many conclusive answers in the film 
negative,"clumsy dialogue , heavy-handed phoney-feeling sentiment , "
negative,"proves a lovely trifle that , unfortunately , is a little too in love with its own cuteness . "
positive,bring tissues . 
negative,the film 's mid-to-low budget is betrayed by the surprisingly shoddy makeup work . 
positive,brings the proper conviction to his role as ( jason bourne ) . 
positive,"as a young woman of great charm , generosity and diplomacy "
positive,there 's something poignant about an artist of 90-plus years taking the effort to share his impressions of life and loss and time and art with us . 
negative,just too silly 
positive,cinematic bon bons 
negative,it is supremely unfunny and unentertaining to watch middle-age and 
positive,a lively and engaging examination of how similar obsessions can dominate a family . 
negative,irritates and 
negative,collapse 
positive,so many of the challenges it poses for itself that one can forgive the film its flaws 
positive,", it serves as a workable primer for the region 's recent history , and would make a terrific 10th-grade learning tool . "
positive,wide-awake all the way through 
negative,"( vainly , i think ) "
negative,is one big excuse to play one lewd scene after another . 
positive,is effective if you stick with it 
positive,that underscore the importance of family tradition and familial community 
positive,"delivers what it promises : a look at the `` wild ride '' that ensues when brash young men set out to conquer the online world with laptops , cell phones and sketchy business plans "
negative,"watching this digital-effects-heavy , supposed family-friendly comedy "
negative,absolutely and completely ridiculous and 
positive,'s a very tasteful rock and roll movie . 
negative,"the movie is almost completely lacking in suspense , surprise and consistent emotional conviction . "
positive,realistic portrayal 
negative,"as if trying to grab a lump of play-doh , the harder that liman tries to squeeze his story "
positive,well-thought stunts or 
positive,reveals how important our special talents can be when put in service of of others . 
negative,no lika da 
positive,a welcome relief 
positive,the promise of digital filmmaking 
negative,just one that could easily wait for your pay per view dollar 
negative,justify a theatrical simulation of the death camp of auschwitz ii-birkenau 
positive,extraordinary faith 
positive,have i seen a film so willing to champion the fallibility of the human heart 
positive,", sometimes beautiful adaptation "
negative,about as interesting 
positive,"caruso sometimes descends into sub-tarantino cuteness ... but for the most part he makes sure the salton sea works the way a good noir should , keeping it tight and nasty . "
negative,"overlong , and bombastic "
negative,derivative and hammily 
positive,"most audacious , outrageous , "
positive,at its best moments 
negative,disney again ransacks its archives for a quick-buck sequel . 
positive,"that final , beautiful scene "
positive,"some movies suck you in despite their flaws , "
positive,"eats , meddles , argues , laughs , kibbitzes and fights "
negative,"the problem with the film is whether these ambitions , laudable in themselves , justify a theatrical simulation of the death camp of auschwitz ii-birkenau . "
positive,", compelling "
positive,infectiously 
positive,"the picture runs a mere 84 minutes , but it 's no glance . "
negative,think of this dog of a movie 
positive,'s remarkable procession of sweeping pictures that have reinvigorated the romance genre . 
negative,those so-so films that could have been much better 
positive,a passable date film 
positive,imax in short 
negative,i hate it . 
positive,'s pleasant enough -- and oozing with attractive men 
negative,"no one involved , save dash , shows the slightest aptitude for acting "
negative,in this wildly uneven movie 
positive,"pokes , provokes , takes expressionistic license "
negative,"like one of ( spears ' ) music videos in content -- except that it goes on for at least 90 more minutes and , worse , that you have to pay if you want to see it "
positive,"with color and depth , and rather a good time "
positive,"silly , outrageous , ingenious "
negative,being able to hit on a 15-year old when you 're over 100 
negative,"the story of trouble every day ... is so sketchy it amounts to little more than preliminary notes for a science-fiction horror film , and the movie 's fragmentary narrative style makes piecing the story together frustrating difficult . "
positive,the year 's best and most unpredictable comedy 
negative,starts off so bad that you feel like running out screaming 
negative,men in black ii achieves ultimate insignificance -- it 's the sci-fi comedy spectacle as whiffle-ball epic . 
positive,elvira fans could hardly ask for more . 
positive,a good one 
negative,", plodding picture "
negative,"the character dramas , which never reach satisfying conclusions "
negative,lost in the translation this time 
positive,speak for it while it forces you to ponder anew what a movie can be 
positive,enables shafer to navigate spaces both large ... and small ... with considerable aplomb 
negative,a plot cobbled together from largely flat and uncreative moments 
negative,inane and awful 
negative,told in scattered fashion 
positive,takes chances that are bold by studio standards 
negative,"believe it or not , jason actually takes a backseat in his own film to special effects "
negative,only thing to fear about `` fear dot com '' 
negative,whole mess 
positive,manages to infuse the rocky path to sibling reconciliation with flashes of warmth and gentle humor 
positive,working from a surprisingly sensitive script co-written by gianni romoli ... ozpetek avoids most of the pitfalls you 'd expect in such a potentially sudsy set-up . 
negative,a résumé loaded with credits like `` girl in bar # 3 
positive,enjoy the ride 
negative,very little to add beyond the dark visions already relayed by superb recent predecessors 
negative,"the , yes , snail-like pacing "
negative,an extremely unpleasant film . 
positive,"if it is n't entirely persuasive , it does give exposure to some talented performers "
negative,"the whole affair , true story or not , feels incredibly hokey ... "
negative,are all things we 've seen before 
positive,poignant and leavened 
positive,breathless anticipation 
positive,significantly better 
negative,as predictable as the tides 
positive,bewilderingly brilliant and entertaining 
positive,it 's smooth and professional 
negative,", unassuming , subordinate "
negative,the horror 
positive,a technically superb film 
positive,the positive change in tone here seems to have recharged him . 
positive,"pays earnest homage to turntablists and beat jugglers , old schoolers and current innovators "
negative,a dim 
negative,", vicious and absurd "
negative,because he acts so goofy all the time 
positive,to a kinetic life so teeming that even cranky adults may rediscover the quivering kid inside 
positive,"'s at once laughable and compulsively watchable , "
positive,merit its 103-minute length 
positive,the value and respect for the term epic cinema 
negative,as a dentist 's waiting room 
positive,showing honest emotions 
negative,amazingly lame . 
negative,confessions may not be a straightforward bio 
negative,seems a disappointingly thin slice of lower-class london life ; despite the title ... amounts to surprisingly little 
negative,the story is bogus and 
positive,this comic gem is as delightful as it is derivative . 
positive,to spare wildlife 
negative,ugly as the shabby digital photography 
negative,understand the difference between dumb fun and just plain dumb 
positive,traditionally structured 
negative,frida is n't that much different from many a hollywood romance . 
positive,does point the way for adventurous indian filmmakers toward a crossover into nonethnic markets . 
positive,are worth the price of admission ... if `` gory mayhem '' is your idea of a good time 
negative,"was produced by jerry bruckheimer and directed by joel schumacher , and reflects the worst of their shallow styles : wildly overproduced , inadequately motivated every step of the way and demographically targeted to please every one ( and no one ) "
negative,carnage and 
negative,"degraded , handheld blair witch video-cam footage "
negative,second fiddle 
negative,about the folly of superficiality that is itself 
negative,"serves as auto-critique , and its clumsiness as its own most damning censure . "
negative,tedious norwegian offering which somehow snagged an oscar nomination . 
negative,", esther kahn is unusual but unfortunately also irritating . "
positive,a stylish exercise 
negative,halfway through this picture i was beginning to hate it 
negative,a setup so easy it borders on facile 
negative,a thoroughly awful movie 
positive,takes hold and grips hard 
negative,"look smeary and blurry , to the point of distraction "
positive,the picture 's fascinating byways 
negative,"guns , cheatfully filmed martial arts , disintegrating bloodsucker computer effects and jagged camera moves "
negative,"breezy , distracted rhythms "
negative,than this mess 
positive,"evanescent , seamless and sumptuous stream "
positive,slick and manufactured to claim street credibility . 
positive,"take care is nicely performed by a quintet of actresses , "
positive,valuable messages 
positive,in no small part thanks to lau 
negative,two guys who desperately want to be quentin tarantino when they grow up 
negative,no new plot conceptions 
negative,essentially a collection of bits -- 
negative,does n't bode well for the rest of it 
positive,elevated by it -- the kind of movie 
negative,usual worst 
positive,"hugh grant , who has a good line in charm "
positive,arrive early and stay late 
positive,"is a pan-american movie , with moments of genuine insight into the urban heart . "
negative,i could have used my two hours better watching being john malkovich again . 
positive,"shot in artful , watery tones of blue , green and brown "
positive,an unorthodox little film noir organized crime story that includes one of the strangest 
positive,considerable aplomb 
positive,acted by diane lane and richard gere . 
negative,scant 
positive,an admittedly middling film 
negative,too ludicrous 
positive,the rock 's fighting skills are more in line with steven seagal 
positive,rich and full 
positive,"warm water under a red bridge is a celebration of feminine energy , a tribute to the power of women to heal . "
positive,"that uses a sensational , real-life 19th-century crime as a metaphor for "
positive,", home movie will leave you wanting more , not to mention leaving you with some laughs and a smile on your face . "
positive,", the film retains ambiguities that make it well worth watching . "
negative,ultra-cheesy dialogue 
positive,added depth and resonance 
positive,the sensational 
positive,huge-screen format to make an old-fashioned nature film that educates viewers with words and pictures while entertaining them 
negative,handsome but unfulfilling suspense drama 
negative,'s not very good either . 
negative,in her most charmless 
positive,makes an unusual but pleasantly haunting debut behind the camera . 
positive,"a fine , rousing , g-rated family film , aimed mainly at little kids but with plenty of entertainment value to keep grown-ups from squirming in their seats . "
negative,"everything about girls ca n't swim , even its passages of sensitive observation , feels secondhand , familiar -- and not in a good way . "
positive,the cast is spot on and 
negative,ugly digital video 
positive,can only love the players it brings to the fore for the gifted but no-nonsense human beings they are and for the still-inestimable contribution they have made to our shared history 
negative,rather choppy 
negative,becomes one more dumb high school comedy about sex gags and prom dates 
positive,demands and receives excellent performances 
positive,"xxx is a blast of adrenalin , "
positive,pure escapism 
positive,create a film that 's not merely about kicking undead *** 
positive,about love and culture 
negative,is worse : 
negative,horrifying 
negative,mourns her tragedies in private 
negative,the action scenes are poorly delivered 
negative,it 's so bad 
negative,so bad 
positive,", 84 minutes is short "
negative,"dabbles all around , never gaining much momentum "
positive,a masterpiece 
positive,"a lot to do with the casting of juliette binoche as sand , who brings to the role her pale , dark beauty and characteristic warmth "
negative,does n't leave you with much . 
positive,good acting 
positive,"like most of jaglom 's films , some of it is honestly affecting "
negative,"marivaux 's rhythms , and mira sorvino 's limitations as a classical actress "
negative,is less successful on other levels 
positive,'s still quite worth seeing 
positive,intelligent and moving . 
negative,he appears miserable throughout as he swaggers through his scenes 
positive,men 
positive,accomplish what few sequels can 
negative,"a clunky tv-movie approach to detailing a chapter in the life of the celebrated irish playwright , poet and drinker "
negative,"i 'm not sure which half of dragonfly is worse : the part where nothing 's happening , or the part where something 's happening "
positive,"exhilarating , funny and fun . "
positive,bound to appeal to women looking for a howlingly trashy time 
negative,", it never quite makes the grade as tawdry trash . "
positive,has the right stuff for silly summer entertainment and has enough laughs to sustain interest to the end . 
positive,"endearing , caring "
positive,"seagal , who looks more like danny aiello these days "
negative,"enactments , however fascinating they may be as history , are too crude to serve the work especially well . "
positive,"not everything in this ambitious comic escapade works , but coppola , along with his sister , sofia , is a real filmmaker "
negative,the dehumanizing and ego-destroying process 
negative,taboo subject matter 
positive,see this 
negative,utterly incompetent conclusion 
positive,has always been part of for the most part wilde 's droll whimsy helps `` being earnest '' overcome its weaknesses and parker 's creative interference ... 
positive,you find yourself rooting for gai 's character to avoid the fate that has befallen every other carmen before her 
negative,run for cover 
negative,low budget 
positive,a deceptively casual ode 
negative,"walked out muttering words like `` horrible '' and `` terrible , '' "
positive,help chicago make the transition from stage to screen with considerable appeal intact 
positive,you have ellen pompeo sitting next to you for the ride 
negative,a giant step backward 
positive,true fans 
negative,just copies 
positive,quite rich and exciting 
positive,luminous interviews and amazingly evocative film from three decades ago 
negative,"from lynch , jeunet , and von trier while failing to find a spark of its own "
positive,", you ca n't help but get caught up in the thrill of the company 's astonishing growth . "
negative,this frozen tundra soap opera 
positive,a showdown 
negative,is simply too overdone 
positive,greatly 
positive,free 
positive,intriguing species 
negative,try and evade 
positive,"scherfig , who has had a successful career in tv "
positive,watching it leaves you giddy 
positive,"beautifully acted and directed , it 's clear that washington most certainly has a new career ahead of him if he so chooses . "
negative,far tamer 
positive,outrageously creative action 
positive,the most purely enjoyable and satisfying evenings 
negative,is never any question of how things will turn out 
negative,only open new wounds 
negative,despite suffering a sense-of-humour failure 
positive,for a story 
positive,in addition to hoffman 's powerful acting clinic 
positive,right stuff 
positive,the wonderful cinematography and naturalistic acting 
positive,high-concept films 
negative,sleepwalk through vulgarities in a sequel you can refuse 
negative,with no reason for being 
negative,"just about all of the film is confusing on one level or another , making ararat far more demanding than it needs to be . "
positive,"invigorating , surreal , and resonant "
positive,"the chateau , a sense of light-heartedness , that makes it attractive throughout "
positive,have a passion for the material 
positive,"maybe it is formula filmmaking , but there 's nothing wrong with that if the film is well-crafted and this one is . "
negative,a movie that ca n't get sufficient distance from leroy 's 
positive,romanticized rendering 
positive,is terrific as rachel 
negative,of special effects that run the gamut from cheesy to cheesier to cheesiest 
negative,the worst film a man has made about women since valley of the dolls 
negative,"come , already having been recycled more times than i 'd care to count "
positive,with awe 
positive,joyous romp of a film . 
positive,a nonstop hoot 
negative,", partisans and sabotage "
negative,gory as the scenes of torture and self-mutilation 
positive,just as the recent argentine film son of the bride reminded us that a feel-good movie can still show real heart 
positive,"ub equally spoofs and celebrates the more outre aspects of ` black culture ' and the dorkier aspects of ` white culture , ' even as it points out how inseparable the two are . "
negative,the package in which this fascinating -- and timely -- content comes wrapped is disappointingly generic . 
negative,"this obscenely bad dark comedy , so crass "
positive,naomi watts is terrific as rachel ; her petite frame and vulnerable persona emphasising her plight and isolation 
positive,exciting and 
negative,schticky 
positive,and in the best way 
